title,description,date,slug,tags
The Before Time,A blog post about the before time,2020-10-07,the-before-time,"personal"
This Time,A blog post about this time,2020-08-30,this-time,"personal"
Tomorrow,A blog post about tomorrow,2020-11-15,tomorrow,"personal"
We Have to be Patient,Keep focussed on the vision not the means of attainment,2020-11-21,patience,"personal"
Tech Blog,This can also be a tech blog,2020-11-21,techblog,"tech"
CSV Parser,Client side CSV parsing investigation,2020-12-19,csv-parser,"tech"
GreenSock it,Animate an svg in Vue with GreenSock,2020-12-27,"gsap","tech"